{
  "schemaVersion": "1.0.0",
  "product": "WebTest Agent",
  "sessionId": "rec_sample_fixture_001",
  "inspectedTabId": 42,
  "startedAt": "2026-09-21T10:00:00.000Z",
  "endedAt": "2026-09-21T10:00:12.000Z",
  "configuration": {
    "allowedOrigins": ["http://127.0.0.1:8765"],
    "includePatterns": ["/api/"],
    "excludePatterns": ["analytics", "telemetry", "doubleclick"],
    "maxOperations": 1000
  },
  "actions": [
    {
      "id": "act-login",
      "sessionId": "rec_sample_fixture_001",
      "type": "click",
      "timestamp": "2026-09-21T10:00:01.000Z",
      "pageUrl": "http://127.0.0.1:8765/",
      "locator": {"strategy": "test-attribute", "value": "login"}
    },
    {
      "id": "act-list",
      "sessionId": "rec_sample_fixture_001",
      "type": "click",
      "timestamp": "2026-09-21T10:00:02.000Z",
      "pageUrl": "http://127.0.0.1:8765/",
      "locator": {"strategy": "test-attribute", "value": "list-records"}
    },
    {
      "id": "act-create",
      "sessionId": "rec_sample_fixture_001",
      "type": "click",
      "timestamp": "2026-09-21T10:00:03.000Z",
      "pageUrl": "http://127.0.0.1:8765/",
      "locator": {"strategy": "test-attribute", "value": "create-record"}
    },
    {
      "id": "act-update",
      "sessionId": "rec_sample_fixture_001",
      "type": "click",
      "timestamp": "2026-09-21T10:00:05.000Z",
      "pageUrl": "http://127.0.0.1:8765/",
      "locator": {"strategy": "role", "value": "button", "role": "button", "name": "Rename"}
    },
    {
      "id": "act-process",
      "sessionId": "rec_sample_fixture_001",
      "type": "click",
      "timestamp": "2026-09-21T10:00:07.000Z",
      "pageUrl": "http://127.0.0.1:8765/",
      "locator": {"strategy": "role", "value": "button", "role": "button", "name": "Process"}
    }
  ],
  "operations": [
    {
      "id": "req-login",
      "sessionId": "rec_sample_fixture_001",
      "timestamp": "2026-09-21T10:00:01.050Z",
      "pageUrl": "http://127.0.0.1:8765/",
      "resourceType": "fetch",
      "request": {
        "method": "POST",
        "url": "http://127.0.0.1:8765/api/login",
        "normalizedPath": "/api/login",
        "query": [],
        "headers": [{"name": "Content-Type", "value": "application/json"}],
        "contentType": "application/json",
        "body": {"username": "${TEST_USERNAME}", "password": "${TEST_PASSWORD}"}
      },
      "response": {
        "status": 200,
        "statusText": "OK",
        "headers": [{"name": "Content-Type", "value": "application/json"}],
        "contentType": "application/json",
        "body": {"accessToken": "${API_TOKEN}", "tokenType": "Bearer", "expiresIn": 3600}
      },
      "timing": {"totalMs": 8, "waitMs": 6},
      "relatedActionId": "act-login",
      "included": true
    },
    {
      "id": "req-list",
      "sessionId": "rec_sample_fixture_001",
      "timestamp": "2026-09-21T10:00:02.050Z",
      "pageUrl": "http://127.0.0.1:8765/",
      "resourceType": "fetch",
      "request": {
        "method": "GET",
        "url": "http://127.0.0.1:8765/api/records",
        "normalizedPath": "/api/records",
        "query": [],
        "headers": [{"name": "Authorization", "value": "Bearer ${API_TOKEN}"}]
      },
      "response": {
        "status": 200,
        "headers": [{"name": "Content-Type", "value": "application/json"}],
        "contentType": "application/json",
        "body": {"items": [{"id": "00000000-0000-4000-8000-000000000001", "name": "Seed record", "quantity": 1, "status": "ready", "archived": false, "createdAt": "2026-01-01T00:00:00Z"}], "count": 1}
      },
      "timing": {"totalMs": 5},
      "relatedActionId": "act-list",
      "included": true
    },
    {
      "id": "req-create",
      "sessionId": "rec_sample_fixture_001",
      "timestamp": "2026-09-21T10:00:03.050Z",
      "pageUrl": "http://127.0.0.1:8765/",
      "resourceType": "fetch",
      "request": {
        "method": "POST",
        "url": "http://127.0.0.1:8765/api/records",
        "normalizedPath": "/api/records",
        "query": [],
        "headers": [{"name": "Authorization", "value": "Bearer ${API_TOKEN}"}, {"name": "Content-Type", "value": "application/json"}],
        "contentType": "application/json",
        "body": {"name": "Demo record", "quantity": 2}
      },
      "response": {
        "status": 201,
        "statusText": "Created",
        "headers": [{"name": "Content-Type", "value": "application/json"}],
        "contentType": "application/json",
        "body": {"id": "11111111-1111-4111-8111-111111111111", "name": "Demo record", "quantity": 2, "status": "ready", "archived": false, "createdAt": "2026-09-21T10:00:03Z"}
      },
      "timing": {"totalMs": 7},
      "relatedActionId": "act-create",
      "included": true
    },
    {
      "id": "req-get-created",
      "sessionId": "rec_sample_fixture_001",
      "timestamp": "2026-09-21T10:00:04.000Z",
      "pageUrl": "http://127.0.0.1:8765/",
      "resourceType": "fetch",
      "request": {
        "method": "GET",
        "url": "http://127.0.0.1:8765/api/records/11111111-1111-4111-8111-111111111111",
        "normalizedPath": "/api/records/{recordId}",
        "query": [],
        "headers": [{"name": "Authorization", "value": "Bearer ${API_TOKEN}"}]
      },
      "response": {
        "status": 200,
        "headers": [{"name": "Content-Type", "value": "application/json"}],
        "contentType": "application/json",
        "body": {"id": "11111111-1111-4111-8111-111111111111", "name": "Demo record", "quantity": 2, "status": "ready", "archived": false, "createdAt": "2026-09-21T10:00:03Z"}
      },
      "timing": {"totalMs": 4},
      "relatedActionId": "act-create",
      "included": true
    },
    {
      "id": "req-update",
      "sessionId": "rec_sample_fixture_001",
      "timestamp": "2026-09-21T10:00:05.050Z",
      "pageUrl": "http://127.0.0.1:8765/",
      "resourceType": "fetch",
      "request": {
        "method": "PUT",
        "url": "http://127.0.0.1:8765/api/records/11111111-1111-4111-8111-111111111111",
        "normalizedPath": "/api/records/{recordId}",
        "query": [],
        "headers": [{"name": "Authorization", "value": "Bearer ${API_TOKEN}"}, {"name": "Content-Type", "value": "application/json"}],
        "contentType": "application/json",
        "body": {"name": "Updated from UI"}
      },
      "response": {
        "status": 200,
        "headers": [{"name": "Content-Type", "value": "application/json"}],
        "contentType": "application/json",
        "body": {"id": "11111111-1111-4111-8111-111111111111", "name": "Updated from UI", "quantity": 2, "status": "ready", "archived": false, "createdAt": "2026-09-21T10:00:03Z"}
      },
      "timing": {"totalMs": 6},
      "relatedActionId": "act-update",
      "included": true
    },
    {
      "id": "req-process",
      "sessionId": "rec_sample_fixture_001",
      "timestamp": "2026-09-21T10:00:07.050Z",
      "pageUrl": "http://127.0.0.1:8765/",
      "resourceType": "fetch",
      "request": {
        "method": "POST",
        "url": "http://127.0.0.1:8765/api/records/11111111-1111-4111-8111-111111111111/process",
        "normalizedPath": "/api/records/{recordId}/process",
        "query": [],
        "headers": [{"name": "Authorization", "value": "Bearer ${API_TOKEN}"}, {"name": "Content-Type", "value": "application/json"}],
        "contentType": "application/json",
        "body": {}
      },
      "response": {
        "status": 202,
        "statusText": "Accepted",
        "headers": [{"name": "Content-Type", "value": "application/json"}],
        "contentType": "application/json",
        "body": {"jobId": "22222222-2222-4222-8222-222222222222", "recordId": "11111111-1111-4111-8111-111111111111", "status": "pending"}
      },
      "timing": {"totalMs": 6},
      "relatedActionId": "act-process",
      "included": true
    },
    {
      "id": "req-job-pending",
      "sessionId": "rec_sample_fixture_001",
      "timestamp": "2026-09-21T10:00:07.150Z",
      "pageUrl": "http://127.0.0.1:8765/",
      "resourceType": "fetch",
      "request": {
        "method": "GET",
        "url": "http://127.0.0.1:8765/api/jobs/22222222-2222-4222-8222-222222222222",
        "normalizedPath": "/api/jobs/{jobId}",
        "query": [],
        "headers": [{"name": "Authorization", "value": "Bearer ${API_TOKEN}"}]
      },
      "response": {
        "status": 200,
        "headers": [{"name": "Content-Type", "value": "application/json"}],
        "contentType": "application/json",
        "body": {"jobId": "22222222-2222-4222-8222-222222222222", "recordId": "11111111-1111-4111-8111-111111111111", "status": "pending"}
      },
      "timing": {"totalMs": 4},
      "relatedActionId": "act-process",
      "included": true
    },
    {
      "id": "req-job-complete",
      "sessionId": "rec_sample_fixture_001",
      "timestamp": "2026-09-21T10:00:07.500Z",
      "pageUrl": "http://127.0.0.1:8765/",
      "resourceType": "fetch",
      "request": {
        "method": "GET",
        "url": "http://127.0.0.1:8765/api/jobs/22222222-2222-4222-8222-222222222222",
        "normalizedPath": "/api/jobs/{jobId}",
        "query": [],
        "headers": [{"name": "Authorization", "value": "Bearer ${API_TOKEN}"}]
      },
      "response": {
        "status": 200,
        "headers": [{"name": "Content-Type", "value": "application/json"}],
        "contentType": "application/json",
        "body": {"jobId": "22222222-2222-4222-8222-222222222222", "recordId": "11111111-1111-4111-8111-111111111111", "status": "completed", "completedAt": "2026-09-21T10:00:07Z"}
      },
      "timing": {"totalMs": 4},
      "relatedActionId": "act-process",
      "included": true
    },
    {
      "id": "req-final",
      "sessionId": "rec_sample_fixture_001",
      "timestamp": "2026-09-21T10:00:08.000Z",
      "pageUrl": "http://127.0.0.1:8765/",
      "resourceType": "fetch",
      "request": {
        "method": "GET",